{
  "schema_version": "obs.hypothesis_set.v1",
  "scope": "run",
  "run_id": "R-TEST",
  "hypotheses": [
    {
      "hypothesis_id": "H001",
      "statement": "CPU scheduling pressure may be relevant to the observed latency symptom.",
      "status": "needs_evidence",
      "confidence": "low",
      "supports": [],
      "contradicts": [],
      "missing_evidence": ["process.runqueue_latency"],
      "next_discriminating_probes": ["probe.scheduler_snapshot"],
      "claim_boundary": "hypothesis_only",
      "data_quality": {
        "dropped": false,
        "drop_count": 0,
        "throttled": false,
        "missing": [],
        "truncated": false,
        "clock_confidence": "medium",
        "notes": []
      }
    }
  ],
  "data_quality": {
    "dropped": false,
    "drop_count": 0,
    "throttled": false,
    "missing": [],
    "truncated": false,
    "clock_confidence": "medium",
    "notes": []
  }
}
